{
  "schemaVersion": "2026-07-05-ns3-e1-v1",
  "moduleName": "cafeFlow",
  "moduleTitle": "Cafe Flow",
  "userLanguage": "pt-BR",
  "sourcePrompt": "Criar um modulo para uma cafeteria pequena controlar pedidos do balcao ate a retirada.",
  "problem": "A cafeteria precisa registrar pedidos, acompanhar preparo e avisar quando o pedido estiver pronto para retirada, sem misturar responsabilidades de caixa, cozinha e atendimento.",
  "actors": [
    {
      "actorId": "atendente",
      "name": "Atendente",
      "assumption": "Registra pedidos no balcao e consulta o andamento."
    },
    {
      "actorId": "cozinha",
      "name": "Cozinha",
      "assumption": "Visualiza pedidos pendentes e marca preparo concluido."
    }
  ],
  "scope": {
    "in": [
      "Registrar pedidos do balcao",
      "Acompanhar status de preparo",
      "Avisar pedido pronto para retirada"
    ],
    "out": [
      "Controle fiscal",
      "Delivery externo",
      "Gestao financeira completa"
    ]
  },
  "openQuestions": [
    {
      "questionId": "pagamentoInicial",
      "question": "Quais formas de pagamento devem aparecer no primeiro fluxo?",
      "classification": "assumed",
      "defaultAnswer": "Dinheiro, cartao e pix",
      "impact": "Afeta apenas a jornada de registro do pedido nesta fase."
    }
  ],
  "assumptions": [
    "O catalogo de produtos ja existe ou sera tratado como dado mestre depois.",
    "O pedido nasce no atendimento e segue para a cozinha."
  ],
  "createdAt": "2026-07-05T00:00:00.000Z"
}

